{
  "schemaVersion": "2.0",
  "projectType": "HARDWARE",
  "classification": {
    "type": "HARDWARE",
    "reason": "Project primarily focuses on physical circuit design, embedded controller selection, sensors/actuators, and wiring connections.",
    "confidence": "HIGH"
  },
  "overview": {
    "projectName": "PulseTrack — Biometric Heart Rate & SpO2 Health Wearable Wristband",
    "summary": "PulseTrack is an ultra-compact ergonomic wrist wearable designed for real-time photoplethysmography (PPG) pulse oximetry, skin temperature tracking, and haptic biometric alert feedback.",
    "problemStatement": "Patients and fitness users needing continuous cardiovascular vitals monitoring are hindered by bulky medical equipment and inconvenient wired fingertip sensors.",
    "targetUsers": [
      "Cardiovascular Wellness Patients",
      "Endurance Athletes & Runners",
      "Elderly Care Supervisors"
    ],
    "goals": [
      "Continuously measure capillary pulse rate and blood oxygen saturation (SpO2)",
      "Vibrate subtly on the wrist when arrhythmia or hypoxic thresholds are detected",
      "Provide a crisp circular color readout with 36-hour single-charge battery autonomy"
    ],
    "scope": [
      "MAX30102 integrated optical pulse oximeter with skin contact lens",
      "NTC precision skin thermistor for surface temperature tracking",
      "ESP32-C3 ultra-low-power RISC-V microcontroller with BLE 5.0",
      "0.96 inch circular AMOLED color display",
      "Coin-type ERM haptic vibration motor",
      "3.7V 300mAh LiPo battery with magnetic pogo-pin charging"
    ],
    "outOfScope": [
      "12-lead clinical ECG diagnostics",
      "Cellular 5G eSIM standalone calling",
      "Invasive blood pressure arterial monitoring"
    ]
  },
  "features": [
    {
      "id": "feature-ppg-sensing",
      "name": "Optical Photoplethysmography Pulse & SpO2 Sensing",
      "description": "Directs red and infrared optical wavelengths through skin capillaries to calculate heart rate and blood oxygen saturation.",
      "priority": "HIGH",
      "roleIds": [
        "role-patient-user"
      ],
      "needsApi": false,
      "needsUi": false,
      "needsPersistence": false
    },
    {
      "id": "feature-skin-temp",
      "name": "Continuous Epidermal Temperature Tracking",
      "description": "Measures localized skin temperature using a calibrated precision thermistor located on the bottom case plate.",
      "priority": "MEDIUM",
      "roleIds": [
        "role-patient-user"
      ],
      "needsApi": false,
      "needsUi": false,
      "needsPersistence": false
    },
    {
      "id": "feature-haptic-alert",
      "name": "Silent Haptic Arrhythmia Vibration Feedback",
      "description": "Triggers discrete pattern pulses from an internal ERM coin motor when heart rate exceeds customized threshold limits.",
      "priority": "HIGH",
      "roleIds": [
        "role-patient-user"
      ],
      "needsApi": false,
      "needsUi": false,
      "needsPersistence": false
    },
    {
      "id": "feature-circular-display",
      "name": "Circular AMOLED Vitals Watchface",
      "description": "Renders live pulse BPM, SpO2 percentage, battery meter, and step counter on a high-contrast circular display.",
      "priority": "HIGH",
      "roleIds": [
        "role-patient-user"
      ],
      "needsApi": false,
      "needsUi": false,
      "needsPersistence": false
    }
  ],
  "roles": [
    {
      "id": "role-patient-user",
      "name": "Wearable User",
      "description": "Wears wristband during daily activities and inspects real-time vitals and vibration alerts.",
      "permissions": [
        "view_live_vitals",
        "dismiss_haptic_alert",
        "pair_bluetooth_phone"
      ],
      "interactive": true
    }
  ],
  "requirements": [
    {
      "id": "req-ppg-accuracy",
      "type": "FUNCTIONAL",
      "description": "System shall sample PPG sensor at 100Hz with digital noise reduction to filter motion artifacts.",
      "featureIds": [
        "feature-ppg-sensing"
      ],
      "acceptanceCriteria": [
        "Heart rate accuracy within +/- 3 BPM compared to ECG baseline",
        "SpO2 accuracy within +/- 2%"
      ],
      "source": "USER_STATED"
    },
    {
      "id": "req-battery-life",
      "type": "NON_FUNCTIONAL",
      "description": "Device must operate for a minimum of 36 continuous hours on a single 300mAh battery charge.",
      "featureIds": [
        "feature-circular-display"
      ],
      "acceptanceCriteria": [
        "Deep-sleep current draw under 25uA between display wake-ups",
        "Full recharge in under 60 minutes"
      ],
      "source": "USER_STATED"
    },
    {
      "id": "req-skin-safety",
      "type": "NON_FUNCTIONAL",
      "description": "Enclosure bottom plate and optical window must be biocompatible and hypoallergenic.",
      "featureIds": [
        "feature-skin-temp"
      ],
      "acceptanceCriteria": [
        "ISO 10993 cytotoxicity and skin irritation compliance",
        "IP68 water immersion rating"
      ],
      "source": "AI_ASSUMED"
    }
  ],
  "estimates": {
    "difficulty": "EASY",
    "estimatedDuration": "3–5 weeks",
    "recommendedTeamSize": 2,
    "teamRoles": [
      {
        "role": "Hardware Electronics Engineer",
        "count": 1,
        "responsibility": "Schematic design, breadboard circuit assembly, component sourcing, and enclosure modeling"
      },
      {
        "role": "Embedded Firmware Engineer",
        "count": 1,
        "responsibility": "ESP32 C++/Arduino firmware, ADC filtering algorithms, and I2C display drivers"
      }
    ],
    "estimatedCost": {
      "currency": "USD",
      "minimum": 45,
      "maximum": 120,
      "basis": "Prototyping components, breadboard, custom 3D printed enclosure, and 5V power adapter.",
      "disclaimer": "Approximate estimate based on the supplied requirements."
    },
    "resources": [
      {
        "name": "Electronics Prototyping Bench",
        "type": "HARDWARE",
        "purpose": "Soldering, breadboarding, and digital multimeter testing"
      },
      {
        "name": "3D Printer (PETG Filament)",
        "type": "HARDWARE",
        "purpose": "Fabricating ventilated enclosure chassis"
      }
    ]
  },
  "software": {
    "applicable": false
  },
  "hardware": {
    "applicable": true,
    "workingPrinciple": "MAX30102 optical sensor directs alternating 660nm red and 880nm infrared light into capillary bed tissue. Photodiode voltage fluctuations are sampled via I2C by the ESP32-C3 RISC-V core. If BPM or oxygen saturation violates safety boundaries, a miniature coin vibration motor pulses while the circular AMOLED display turns amber/red.",
    "components": [
      {
        "id": "comp-esp32c3",
        "name": "ESP32-C3 Ultra-Low-Power BLE Micro Module",
        "category": "MICROCONTROLLER",
        "purpose": "Single-core 160MHz RISC-V processor with integrated Bluetooth Low Energy 5.0 and hardware cryptographic engine",
        "quantity": 1,
        "specification": "ESP32-C3-WROOM-02, 160MHz 32-bit RISC-V, 400KB SRAM, 4MB Flash, compact 18x14mm form-factor",
        "alternatives": [
          "nRF52840 BLE SoC",
          "RP2040 Zero"
        ],
        "estimatedUnitCost": 3.2,
        "estimatedTotalCost": 3.2
      },
      {
        "id": "comp-max30102",
        "name": "MAX30102 Optical PPG Heart Rate & SpO2 Sensor",
        "category": "SENSOR",
        "purpose": "Skin-contact photoplethysmography sensor measuring blood volumetric absorption peaks",
        "quantity": 1,
        "specification": "Dual LED (660nm / 880nm), integrated photodetector, 18-bit ADC, I2C interface, 1.8V logic",
        "alternatives": [
          "MAX30100",
          "Pulse Sensor Amped Optical"
        ],
        "estimatedUnitCost": 4.8,
        "estimatedTotalCost": 4.8
      },
      {
        "id": "comp-skin-temp",
        "name": "NTC Precision Medical Skin Thermistor",
        "category": "SENSOR",
        "purpose": "Localized epidermal surface temperature sensor embedded in bottom casing",
        "quantity": 1,
        "specification": "10k ohm @ 25C, 1% tolerance, B-value 3950K, stainless disc contact cap",
        "alternatives": [
          "TMP117 High-Precision Digital Sensor",
          "MLX90614 Contactless IR"
        ],
        "estimatedUnitCost": 1.2,
        "estimatedTotalCost": 1.2
      },
      {
        "id": "comp-vibe-motor",
        "name": "ERM Coin-Type Haptic Micro-Vibration Motor",
        "category": "ACTUATOR",
        "purpose": "Silent tactile wrist notification for threshold alerts and button tap feedback",
        "quantity": 1,
        "specification": "10mm diameter x 3mm height, 3V DC, 75mA, 12,000 RPM eccentric rotating mass",
        "alternatives": [
          "Linear Resonant Actuator (LRA)",
          "Piezo Haptic Disc"
        ],
        "estimatedUnitCost": 1.5,
        "estimatedTotalCost": 1.5
      },
      {
        "id": "comp-oled-round",
        "name": "0.96-Inch Circular AMOLED Color Display",
        "category": "DISPLAY",
        "purpose": "Ultra-crisp circular vitals dashboard showing live pulse BPM and oxygen saturation",
        "quantity": 1,
        "specification": "240x240 pixel resolution, GC9A01 SPI driver, 65k full color, 300 nits brightness",
        "alternatives": [
          "1.28 inch Round LCD",
          "0.96 inch Square Monochrome OLED"
        ],
        "estimatedUnitCost": 5.6,
        "estimatedTotalCost": 5.6
      },
      {
        "id": "comp-lipo",
        "name": "3.7V 300mAh Miniature Rechargeable LiPo Battery",
        "category": "POWER",
        "purpose": "Lightweight internal battery providing 36 hours of continuous biometric tracking",
        "quantity": 1,
        "specification": "3.7V nominal, 300mAh, integrated PCM over-discharge/short-circuit protection, 502030 pouch",
        "alternatives": [
          "LIR2032 Coin Rechargeable Cell",